Category,Question,Answer
About,What is Kenmark ITan Solutions?,Kenmark ITan Solutions is a technology company based in Mumbai, India, offering comprehensive IT services under one roof. We cater to startups, small-medium businesses, and sole proprietors.
About,Where is Kenmark ITan Solutions located?,Our office is located at 601-603, Chaitanya Building, Ram Mandir Signal, Goregaon West, Mumbai - 400104, India.
Services,What services does Kenmark ITan Solutions offer?,We offer a wide range of services including: Web Hosting (shared, VPS, dedicated servers), Web and Mobile App Development, eCommerce Solutions, Blockchain Development, ERP Solutions, Security Solutions, UI/UX Design, Graphic Design, Branding Solutions, SEO and Social Media Marketing, and IT Consultancy.
Services,What hosting services are available?,We provide shared hosting, VPS hosting, dedicated servers, email services, VPN solutions, and private cloud storage solutions.
Services,Do you offer mobile app development?,Yes, we offer mobile app development services for both iOS and Android platforms, along with cross-platform solutions.
Services,What design services do you provide?,We offer UI/UX design services, graphic design, and comprehensive branding solutions tailored to your business needs.
Contact,How can I contact Kenmark ITan Solutions?,You can contact us via email at info@kenmarkitan.com, or reach out to our CTO Mr. Tanooj Sanjeev Mehra at tanooj@kenmarkitan.com (Mobile: +91-9820283097) or our CBO Mr. Piyush Thakur at piyush@kenmarkitan.com (Mobile: +91-9899383385).
Contact,What is the email address for inquiries?,For general inquiries, please email us at info@kenmarkitan.com. For technical matters, contact our CTO, and for business matters, contact our CBO.
FAQ,Do you work with startups?,Yes, we specifically cater to startups, small-medium businesses, and sole proprietors, providing comprehensive IT solutions tailored to their needs.
FAQ,Can you help with eCommerce solutions?,Absolutely! We offer complete eCommerce solutions including website development, payment integration, inventory management, and more.
FAQ,Do you provide ongoing support?,Yes, we provide ongoing support and maintenance services for all our solutions to ensure your systems run smoothly.

